pid,section,label,claimed_category,link,status,open_access,creators,stewards,blurb,added_by,twitter,tools_used,code_repository,order,layout,collection,thumbnail,full
mdh126,collections & exhibits,Composers of Color Resource Project,"webpage, database",https://composersofcolor.hcommons.org/,in development,TRUE,,,"This webpage houses resources for music by composers of color. It is not intended to be limited to (a) traditional music theory topics or (b) notated music in the Western art music tradition. Analytical notes are being made available, while a Google Sheet summarizes music theory topics that can be taught using the repertoire. <br><br>They welcome submissions of annotated scores and lesson plans that incorporate the music of composers of color. This site will be continually updated with more resources for music theory instructors.",Francesca Giannetti,@jo_frankie,"Google Sheets, Humanities Commons",,125,musicdh_item,musicdh,/img/derivatives/simple/mdh126/thumbnail.jpg,/img/derivatives/simple/mdh126/fullwidth.jpg
mdh127,collections & exhibits,Active Citizens Sound Archive,"archive, audio",https://citizensoundarchive.com/,in development,TRUE,,,"The Active Citizens Sound Archive is a multilingual archive of solidarities and collaborations, of diversities and possibilities. It contains recordings made by members of The Syrian and Greek Youth Forum (SGYF), an active citizens group based in Athens, focused on community building, inclusion, and employment. We are recording our activisms and political inclusion activities. The archive presents some of this work. <br> <br> We began making recordings in spring 2019, through a series of workshops on sound recording, skill sharing, and media production. We continue to record life in the city, and are now preparing museum exhibitions and radio programs using these recordings. <br> <br> This work comes from recognising the need to record this moment in Athens – to tell the world that we are building a collective movement aiming to advance the development of Syrians and other communities into active citizens in Athens and Greece. SGYF is a platform for citizenship. We hope this archive will be useful in disrupting the kinds of stories normally told about refugees. Instead, these are recordings made by us, as citizens, opening a collective space for new understandings and representations.",Francesca Giannetti,@jo_frankie,"WordPress, Soundcloud",,126,musicdh_item,musicdh,/img/derivatives/simple/mdh127/thumbnail.jpg,/img/derivatives/simple/mdh127/fullwidth.jpg
mdh128,reference,Soundscapes in the Early Modern World,"Workshop materials, blog",https://emsoundscapes.co.uk/,active,TRUE,"Dr. Rachel Willie (principal investigator), Dr Emilie Murphy (co-investigator)",,"Welcome to ‘Soundscapes in the Early Modern World’, an AHRC-funded international research network that examines how sonic interaction shaped identities c. 1500-1800. It aims to develop new approaches to hearing the sounds of the early modern world, reflect on how we engage with historical soundscapes, and consider the multifaceted relationship between meaning and hearing. <br> <br> The network will extend understanding of the contexts and spaces in which sounds were heard. We are interested in how sounds shaped the lives of people and their communities, and also with the conceptual issues associated with studying past soundscapes.",Francesca Giannetti,@jo_frankie,Wordpress,,127,musicdh_item,musicdh,/img/derivatives/simple/mdh128/thumbnail.jpg,/img/derivatives/simple/mdh128/fullwidth.jpg
mdh129,collections & exhibits,Early Music Online,digital repository,https://www.royalholloway.ac.uk/research-and-teaching/departments-and-schools/music/research/research-projects-and-centres/early-music-online/,active,TRUE,"Dr. Stephen Rose (project director), Dr. Sandra Tuppen (project manager)",,"These digitised volumes contain approximately 10,000 musical compositions, which have been individually indexed. The volumes mainly consist of partbooks of vocal polyphony, but also include some early printed tablatures for keyboard or plucked string instruments. They include music printed in Italy, Germany, France and England. Early Music Online was funded by JISC’s 2011 Rapid Digitisation Programme.",Francesca Giannetti,@jo_frankie,,,128,musicdh_item,musicdh,/img/derivatives/simple/mdh129/thumbnail.jpg,/img/derivatives/simple/mdh129/fullwidth.jpg
mdh130,reference,Early Music Sources,"database, reference",https://www.earlymusicsources.com/,active,TRUE,Elam Rotan,,The aim of Early Music Sources is to simplify the access to the vast amount of online early music sources. The sources database as well as the iconography database enable quick search and gateway to sources according to various categories. For further research you may refer to RISM (sources) and RIDIM (iconography).,Francesca Giannetti,@jo_frankie,,,129,musicdh_item,musicdh,/img/derivatives/simple/mdh130/thumbnail.jpg,/img/derivatives/simple/mdh130/fullwidth.jpg
mdh131,reference,DIAMM (the Digital Image Archive of Medieval Music),"catalogue, collection",https://www.diamm.ac.uk/,active,TRUE,,University of Oxford,"DIAMM (Digital Image Archive of Medieval Music) is a leading resource for the study of medieval manuscripts. We present images and metadata for thousands of manuscripts on this website. We also provide a home for scholarly resources and editions, undertake digital restoration of damaged manuscripts and documents, publish high-quality facsimiles, and offer our expertise as consultants. DIAMM is a primarily Musicological resource, though we have photographed early documents for other projects such as the Anglo-Saxon Charters project at Cambridge University (Prof Simon Keynes) and Alison Stones' Arthurian MSS project at the University of Pittsburgh. The remit of the project is to photograph and archive images of:
all fragments of English polyphonic music written before 1550; all complete sources of English polyphonic music before 1500, and as many as practically possible 1500-1550; all fragments of European polyphony 1300-1450; as many complete manuscripts of European polphony 1300-1450, and beyond as is possible and practicable.",Francesca Giannetti,@jo_frankie,,,130,musicdh_item,musicdh,/img/derivatives/simple/mdh131/thumbnail.jpg,/img/derivatives/simple/mdh131/fullwidth.jpg
mdh132,edition,Furnace and Fugue: A Digital Edition of Michael Maier’s Atalanta fugiens (1618),"digitized resource, reference",https://furnaceandfugue.org/index.html,active,TRUE,"Tara Nummedal, Donna Bilak",,"<i>Furnace and Fugue</i> brings to life in digital form an enigmatic seventeenth-century text, Michael Maier’s alchemical emblem book <i>Atalanta fugiens</i>. This intriguing and complex text from 1618 reinterprets Ovid’s legend of Atalanta as an alchemical allegory in a series of fifty emblems, each of which contains text, image, and a musical score for three voices. Re-rendering Maier’s multimedia masterpiece as an enhanced digital publication, <i>Furnace and Fugue</i> allows contemporary readers to hear, see, manipulate, and investigate <i>Atalanta fugiens</i> in ways that were perhaps imagined when it was composed but were simply impossible to realize in full before now.",Francesca Giannetti,@jo_frankie,,,131,musicdh_item,musicdh,/img/derivatives/simple/mdh132/thumbnail.jpg,/img/derivatives/simple/mdh132/fullwidth.jpg
mdh133,collections & exhibits,Obrecht Mass,website,https://sites.williams.edu/obrechtmass/,active,TRUE,M. Jennifer Bloxam,Williams College,"This website features an audio recreation of Jacob Obrecht's Saint Donatian Mass sung by the Cappella Pratensis, as well as an annotated copy of the score. Essays and images provide additional context.",Francesca Giannetti,@jo_frankie,WordPress,,132,musicdh_item,musicdh,/img/derivatives/simple/mdh133/thumbnail.jpg,/img/derivatives/simple/mdh133/fullwidth.jpg
mdh134,collections & exhibits,Canadian Sheet Music,digital collection,https://archive.org/details/facultyofmusic?and%5B%5D=collection%3A%22canadiansheetmusic%22&sort=titleSorter,active,TRUE,University of Toronto Libraries,Univerity of Toronto/Internet Archive,"The Canadian Sheet Music collection contains approximately 4,000 items featuring either a Canadian imprint or Canadian composer. This digitized collection is a subset of the University of Toronto Sheet Music archival collection.",Stephanie Sussmeier,@StephanieSussme,Internet Archive,,133,musicdh_item,musicdh,/img/derivatives/simple/mdh134/thumbnail.jpg,/img/derivatives/simple/mdh134/fullwidth.jpg
mdh135,collections & exhibits,Edward Johnson Collection,digital collection,https://discoverarchives.library.utoronto.ca/index.php/otufm01-edward-johnson,active,TRUE,University of Toronto Libraries,Univerity of Toronto/Internet Archive,"The collection contains photographs, programs, and press notices of performances of Canadian tenor and administrator, Edward Johnson.(August 22, 1878-1959). Browse digitized items from his archival collection (held at the Music Library), including manuscripts of songs written for him; five collections of published songs; and a scrapbook of programs from his first year as manager of the Metropolitan Opera.",Stephanie Sussmeier,@StephanieSussme,,,134,musicdh_item,musicdh,/img/derivatives/simple/mdh135/thumbnail.jpg,/img/derivatives/simple/mdh135/fullwidth.jpg
mdh136,collections & exhibits,Kathleen Parlow,digital collection,https://discoverarchives.library.utoronto.ca/index.php/otufm02-kathleen-parlow,active,TRUE,University of Toronto Libraries,Univerity of Toronto/Internet Archive,"This collection contains materials relating to the life and career of Kathleen Parlow, Canadian violinist and teacher (20 September 1890- 19 August 1963). Materials include photographs, correspondence, daybooks, sheet music, concert programs, press, and personal material.",Stephanie Sussmeier,@StephanieSussme,,,135,musicdh_item,musicdh,/img/derivatives/simple/mdh136/thumbnail.jpg,/img/derivatives/simple/mdh136/fullwidth.jpg
mdh137,collections & exhibits,J. Churchill Arlidge,digital collection,https://discoverarchives.library.utoronto.ca/index.php/otufm34-j-churchill-arlidge,active,TRUE,University of Toronto Libraries,Univerity of Toronto/Internet Archive,"The J. (Joseph) Churchill Arlidge collection contains writings, family letters, photographs, photocopies of biographical documents, collected by Bob Arlidge, and manuscripts of Arlidge's original compositions, arrangements, and transcriptions of performed pieces. J. (Joseph) Churchill Arlidge (March 17, 1849-January 22, 1913) was a British-born flutist, organist, teacher, and composer who worked and lived in Toronto.",Stephanie Sussmeier,@StephanieSussme,,,136,musicdh_item,musicdh,/img/derivatives/simple/mdh137/thumbnail.jpg,/img/derivatives/simple/mdh137/fullwidth.jpg
mdh138,collections & exhibits,Opera,digital collection,https://archive.org/details/facultyofmusic?and[]=subject%3A%22Operas%22,active,TRUE,University of Toronto Libraries,Univerity of Toronto/Internet Archive,"This is a collection of French Opera scores published before 1923. It includes materials from the University of Toronto's Rare Book Room, as well as items contributed by partnership institutions including the University of Ottawa.",Stephanie Sussmeier,@StephanieSussme,,,137,musicdh_item,musicdh,/img/derivatives/simple/mdh138/thumbnail.jpg,/img/derivatives/simple/mdh138/fullwidth.jpg
mdh139,collections & exhibits,Digital Archive of North Indian Classical Music,digital collection,https://eap.bl.uk/project/EAP274,in development,TRUE,Amlan Das Gupta,"Jadavpur University, British Library","The Digital Archive of North Indian Classical Music was initiated in 2004 as part of the School of Cultural Texts and Records at Jadavpur University, Kolkata. The aim at inception was to create a collection of digitised recordings of North Indian classical music, and by 2007 a collection of about 1,000 hours was digitised, catalogued and made available. This new project will concentrate on performances of artists usually under-represented in large general collections.",Stephanie Sussmeier,@StephanieSussme,,,138,musicdh_item,musicdh,/img/derivatives/simple/mdh139/thumbnail.jpg,/img/derivatives/simple/mdh139/fullwidth.jpg
mdh140,collections & exhibits,Digital Archive of Bengali Songs,digital collection,https://eap.bl.uk/project/EAP274,in development,TRUE,Amlan Das Gupta,"Jadavpur University, British Library","The Digital Archive of Bengali Songs preserves Bengali songs from 78rpm shellac disc records. The first commercial recording in India was made at Kolkata (then Calcutta) in 1902. Approximately, 4,000 songs (1902-1937) will be digitized containing all types of popular (non-classical) Bengali songs, such as folk, devotional, romantic, comic, songs from theatre and complete musical dramas in the folk tradition etc.",Stephanie Sussmeier,@StephanieSussme,,,139,musicdh_item,musicdh,/img/derivatives/simple/mdh140/thumbnail.jpg,/img/derivatives/simple/mdh140/fullwidth.jpg
mdh141,reference,Music Archive for the Pacific,"webpage, reference",http://hmcs.scu.edu.au/musicarchive/index.html,defunct,TRUE,,Southern Cross University,"The Music Archive for the Pacific has been established at Southern Cross University in Northern New South Wales, Australia, through the generous donation by Malcolm Philpott of approximately three hundred commercial recordings of mainly contemporary Papua New Guinea music, and other related printed materials. The archive covers the music of the indigenous people of Australia (incl. Torres Strait), Papua New Guinea (incl. Bougainville), New Zealand as well as the nations of the Pacific Islands - Cook Islands, Easter Island, Fiji, Hawaii, Nauru, New Caledonia, Rarotonga, Samoa, Solomon Islands, Tahiti, Tonga, Tuvalu, and Vanuatu.",Stephanie Sussmeier,@StephanieSussme,,,140,musicdh_item,musicdh,/img/derivatives/simple/mdh141/thumbnail.jpg,/img/derivatives/simple/mdh141/fullwidth.jpg
mdh142,edition,Digital Splitleaf Psalter,"website, edition",http://splitleaf.org,in development,TRUE,Timothy Duguid,,"A split-leaf psalter is a printed volume in which the pages are cut in half in the middle so that the upper half forms a booklet of tunes, and the lower a booklet of texts. This layout would allow readers to match the texts with the tunes that they know best. Just like a traditional printed split-leaf, the Digital Splitleaf uses the latest in digital technology to bridge the split, so to speak. It empowers you to select the metrical Psalm texts and tunes that you would like to sing. However, once a tune and psalm text have been selected, the Digital Splitleaf Psalter underlays your selected text beneath the music as you would expect from a more traditional psalter or hymnal. This makes reading the music and psalm text much simpler.",Timothy Duguid,@tdrdoog,"Verovio, MEI, TEI, eXistDB",,141,musicdh_item,musicdh,/img/derivatives/simple/mdh142/thumbnail.jpg,/img/derivatives/simple/mdh142/fullwidth.jpg
mdh143,reference,Hymn Tune Index,database,https://hymntune.library.illinois.edu/,active,TRUE,Nicholas Temperley,University of Illinois,"The HTI database contains all hymn tunes printed anywhere in the world with English-language texts up to 1820, and their publication history up to that date.",Timothy Duguid,@tdrdoog,,,142,musicdh_item,musicdh,/img/derivatives/simple/mdh143/thumbnail.jpg,/img/derivatives/simple/mdh143/fullwidth.jpg
mdh144,collections & exhibits,Music Scholarship Online,"website, database",https://muso.arts.gla.ac.uk/,in development,TRUE,"Timothy Duguid, Maristella Feustle, Francesca Giannetti, Elizabeth Grumbach",University of Glasgow,"Music Scholarship Online (MuSO) is a digital hub for conducting music scholarship. Users can search and discover a variety of content relating to music, including archives and museum collections, digital journals and monographs, and born-digital resources.",Timothy Duguid,@tdrdoog,RDF,,143,musicdh_item,musicdh,/img/derivatives/simple/mdh144/thumbnail.jpg,/img/derivatives/simple/mdh144/fullwidth.jpg
mdh145,collections & exhibits,HUAPALA (Hawaiian Music and Hula Archives),"webpage, reference, database",http://www.huapala.org/,active,TRUE,Kaiulani Kanoa_Martin (compiler),Kaiulani Kanoa_Martin (compiler),"This is a collection focused on preserving Hawaiian culture. It includes an alphabetical list of song titles with access to song lyrics, and audio recordings, as well as additional information about musical genres, composers, and instruments.",Stephanie Sussmeier,@StephanieSussme,,,144,musicdh_item,musicdh,/img/derivatives/simple/mdh145/thumbnail.jpg,/img/derivatives/simple/mdh145/fullwidth.jpg
mdh146,reference,Catalogue de la Chanson Française à la Renaissance,database,http://ricercar-old.cesr.univ-tours.fr/3-programmes/basechanson/,active,TRUE,Annie Coeurdevey,Ricercar,"This is a database of French Chansons from the Renaissance containing approximately 9,000 song titles (monadic and polyphonic) drawn from manuscript and printed sources between c.1480 and 1600.",Stephanie Sussmeier,@StephanieSussme,XML,,145,musicdh_item,musicdh,/img/derivatives/simple/mdh146/thumbnail.jpg,/img/derivatives/simple/mdh146/fullwidth.jpg
mdh147,edition,Freischütz Digital,digital edition,https://www.freischuetz-digital.de/,active,TRUE,"Meinard Müller, Gerd Szwillus, Thomas Betzwieser, Joachim Veit, Johannes Kepper, Raffaele Viglianti, Janette Seuffert, Lena Schubert, Solveig Schreiter, Elena Schilke, Daniel Röwenstrunk, Anna Maria Komprecht, Joachim Iffland, Benjamin W. Bohl","Institut für Musikwissenschaft, Goethe-Universität Frankfurt; Musikwissenschaftliches Seminar Detmold/Paderborn; International Audio Laboratories Erlangen; Institut für Informatik, Universität Paderborn","Weber’s <i>Freischütz</i>, as an exemplary pilot project following the draft of a concept derived from Frans Wiering’s <i>Multidimensional Model</i> of authentically digital music editions, was to provide a proof of concept to demonstrate the potential of an innovative editorial technology and to deal with new issues associated with it. Six work packages jointly worked out by four project partners focused on the work’s graphic, logical, and acoustic (or performative) domains, emphasizing at the same time a comprehensive and detailed data contextualization and the formalized linkage concepts required for this. Using MEI, the music-encoding standard for a comprehensive work in Common Western Music Notation (CMN), for the first time and pairing it with a TEI encoding of the verbal text elements opened up completely new possibilities of processing, enriching, and reusing data. By exploring the opportunities for linking to and segmenting audio recordings, the project attempted to contribute to the solution of generic issues in the acoustic field; by demonstrating the potential of its innovative digital-edition model, it endeavored to promote discussion of future edition forms and to encourage further basic research through exemplary investigations of the variance aspect.",Francesca Giannetti,@jo_frankie,"MEI, TEI, Edirom Editor, MusicXML, XSLT, Verovio",,146,musicdh_item,musicdh,/img/derivatives/simple/mdh147/thumbnail.jpg,/img/derivatives/simple/mdh147/fullwidth.jpg
mdh148,reference,Ravi Shankar Collection at CCNY,guide,https://library.ccny.cuny.edu/ravishankar,active,FALSE,Michael Crowley,City College of New York Libraries,A guide describing the contents of the online collection of recordings and scanned documents related to Ravi Shankar's work as a professor at CCNY.,Michael Crowley,@beboplibrarian,Springshare LibGuides,,147,musicdh_item,musicdh,/img/derivatives/simple/mdh148/thumbnail.jpg,/img/derivatives/simple/mdh148/fullwidth.jpg
mdh149,reference,Hatch-Billops Oral History at CCNY,guide,https://library.ccny.cuny.edu/hatchbillops,active,FALSE,Michael Crowley,City College of New York Libraries,"A guide describing the contents of the Hatch-Billops Oral History online -- over 300 hours of taped interiews featuring notable actors, writers, artists and musicians.",Michael Crowley,@beboplibrarian,Springshare LibGuides,,148,musicdh_item,musicdh,/img/derivatives/simple/mdh149/thumbnail.jpg,/img/derivatives/simple/mdh149/fullwidth.jpg
mdh150,software,IncipitSearch,search engine,https://incipitsearch.adwmainz.net/,active,TRUE,"Anna Neovesky, Frederic von Vlahovits",Academy of Sciences and Literature Mainz,"IncipitSearch is a search engine for music-incipits. Incipts are a pragmatic approach for the cataloguing of notated music, in which a few bars of a score are transcribed. IncipitSearch is a service to interconnect musical pieces via metadata. It is also a tool that can be reintegrated into existing digital research platforms. By connecting some of the largest digital collections of music metadata it already offers access to around 1 million incipits.",Anna Neovesky,@annavsk,"PHP Slim Framework, ElasticSearch, Verovio, schema.org",https://github.com/digicademy/incipitSearch,149,musicdh_item,musicdh,/img/derivatives/simple/mdh150/thumbnail.jpg,/img/derivatives/simple/mdh150/fullwidth.jpg
mdh151,laboratories,Digital Music Observatory,"open data observatory, music economy, music & society, diversity & circulation, innovation",https://music.dataobservatory.eu/,in development,TRUE,"Daniel Antal, Andrés García Molina",Reprex BV,"The Digital Music Observatory is a fully automated, open source, open data observatory that links public datasets in order to provide a comprehensive view of the European music industry. The DMO produces key business and policy indicators that enable the growth of music business strategies and national music policies in a way that works both for music lover audiences and the creative enterprises of the sector, and contributes to a more competitive, fair and sustainable European music ecosystem.",Andrés García Molina,,,https://github.com/antaldaniel/musicobservatory,150,musicdh_item,musicdh,/img/derivatives/simple/mdh151/thumbnail.jpg,/img/derivatives/simple/mdh151/fullwidth.jpg
mdh152,collections & exhibits,AudibleRVA,"soundscape, music scene",https://audible-rva.org/,active,TRUE,Andy McGraw,University of Richmond,"AudibleRVA began in 2013 as a Digital Humanities project to study Richmond’s soundscape and music scene. Ongoing projects are organized along several themes: Live Music, Infrastructure, Education, Soundscapes, Noise, and Carceral Soundscapes.
<br>
The project’s core assumption is that a society’s ethical life is partly expressed through the allocation of sonic “goods,” including access to music making and listening and musical infrastructure (venues, schools, stores).",Francesca Giannetti,@jo_frankie,WordPress,,151,musicdh_item,musicdh,/img/derivatives/simple/mdh152/thumbnail.jpg,/img/derivatives/simple/mdh152/fullwidth.jpg
mdh153,laboratories,Connections in Sound,"metadata, dataset, visualization, linked data, digital pilot",https://rootseire.github.io/LC-ITM/,in development,TRUE,Patrick Egan,University College Cork,"In January 2019, a digital pilot entitled Connections in Sound focused on experimenting with audio collections of Irish traditional music. The principal aim was to investigate whether fieldwork audio and its attendant metadata could be linked between collections at the Library of Congress and across the Internet using proof-of-concept Uniform Resource Identifiers (URIs). Through an iterative approach, the team hypothesized that this activity would lead to valuable technical and humanistic insights about the status and possibilities for Irish traditional music as linked data. <a href='https://doi.org/10.21428/3e88f64f.30abd624' target='_blank'>Project review</a> published in <i>Reviews in Digital Humanities</i>.",Francesca Giannetti,@jo_frankie,Tableau,,152,musicdh_item,musicdh,/img/derivatives/simple/mdh153/thumbnail.jpg,/img/derivatives/simple/mdh153/fullwidth.jpg
mdh154,data,LITMUS (Linked Irish Traditional Music),"linked data, ontology, metadata",https://www.itma.ie/litmus,active,TRUE,Lynnsey K. Weissenberger,Irish Traditional Music Archive,"LITMUS (Linked Irish Traditional Music) seeks to improve searching and access to web-based Irish traditional music, song and dance resources. The goal of the LITMUS project was to develop linked data tools to better express what occurs within oral transmission. While tailored to Irish traditional music, it is hoped that this project will provide a working model for other European and non-European traditional musics.",Francesca Giannetti,@jo_frankie,,,153,musicdh_item,musicdh,/img/derivatives/simple/mdh154/thumbnail.jpg,/img/derivatives/simple/mdh154/fullwidth.jpg
mdh155,collections & exhibits,The Mixtape Museum (MXM),archive project,https://mixtapemuseum.org/,active,TRUE,Regan Sommer McCoy,Columbia University,"The Mixtape Museum (MXM) is an archive project established to collect, preserve, and share knowledge related to mixtape history. While the project covers all genres, it prioritizes Hip Hop research through the mixtape lens. 
<br>
The MXM is devoted to advancing public understanding and appreciation of the art, history, technique, and impact mixtapes have made around the world. While encouraging the research of mixtapes as records of time, place and situation, it will also examine the individuals that have shaped their existence.",Francesca Giannetti,@jo_frankie,WordPress,,154,musicdh_item,musicdh,/img/derivatives/simple/mdh155/thumbnail.jpg,/img/derivatives/simple/mdh155/fullwidth.jpg
