pid,section,label,claimed_category,link,status,open_access,creators,stewards,blurb,added_by,twitter,tools_used,code_repository,order,layout,collection,thumbnail,full
mdh184,reference,REFRAIN,database,http://refrain.ac.uk/,active,TRUE,"Anne Ibos-Augé, Mark Everist, and Adam Field","University of Southampton, Université de Tours, Université de Poitiers","The long thirteenth century was characterised by a vernacular musico-poetic culture in which short fragments of text and/or music circulated within and between songs of various types (chanson à refrain, chanson avec des refrains, rondeau), the motet repertory, the romance and a host of other types that impinged on music, literature or both. Controlling the repertory can be time-consuming and problematic: assembling the material to examine even a single family of refrains can involve the identification, location and manipulation of large amounts of material.
<br> <br>
Since the middle of the nineteenth century, scholars of French literature have been identifying refrains in the single text on which they were working, but it was not until 1964 that Friedrich Gennrich published the first attempt at a catalogue, an experiment that was amplified in 1969 by Nico H. J. van den Boogaard. Both these works were catalogues, and van den Boogaard’s was also an edition of the texts of the refrains. Music was not mentioned in the catalogue and not edited. Both these shortcomings were rectified in Anne Ibos-Augé's dissertation, ‘La fonction des insertions lyriques dans des œuvres narratives et didactiques aux xiiième et xivème siècles’. 
<br> <br> REFRAIN seeks to integrate these pre-existing work on the refrain into a single, searchable, database and to bring the data up to date. It indexes not only the location of the refrain in its song, motet, romance or other context but delivers the exact manuscript reading for every occurrence of every refrain in every manuscript source.",Francesca Giannetti,@jo_frankie,,,183,musicdh_item,musicdh,/img/derivatives/simple/mdh184/thumbnail.jpg,/img/derivatives/simple/mdh184/fullwidth.jpg
mdh185,collections & exhibits,Paisajes sonoros históricos (c. 1200–c. 1800) / Historical Soundscapes (c. 1200–c. 1800),website,http://historicalsoundscapes.com/,active,TRUE,Juan Ruiz Jiménez and Ignacio José Lizarán Rus,,"<i>Paisajes sonoros históricos</i> (c.1200-c.1800) is designed to explore historical urban soundscapes in Andalusian cities, aided by the outreach potential made possible through new technologies. This innovative approach will allow users to recreate music of the past in historical locations through the use of online interactive maps with digital resources (documents, videos, sounds, etc.). The contents aim to be inclusive and help achieve a better understanding of urban culture, establishing an aesthetic and intellectual dialogue with their sensorial aural history through an interdisciplinary approach that brings together urban musicology with areas including cultural history and art history, among others. Our main aim has been to create a digital platform to map the soundscapes of the cities of Granada and Seville as a paradigm that should prove adaptable to any urban centre over different historical periods. This platform is intended to be a useful and innovative tool for the educational institutions (from primary to tertiary education), museums, tourist boards, etc. of different cities.",Francesca Giannetti,@jo_frankie,,,184,musicdh_item,musicdh,/img/derivatives/simple/mdh185/thumbnail.jpg,/img/derivatives/simple/mdh185/fullwidth.jpg
mdh186,data,ELVIS Database,"database, repository",https://database.elvisproject.ca/,archived,TRUE,,Single Interface for Music Score Searching and Analysis project (SIMSSA),"The ELVIS database is one of the largest online repositories of symbolic musical data. Here you can search for music in different file formats—including MEI, MusicXML, MIDI, and others—and download pieces to analyze with softward such as music21. You can also contribute to the database by uploading your own files. Registration is free and open to everyone.",Francesca Giannetti,@jo_frankie,,https://github.com/ELVIS-Project/simssadb,185,musicdh_item,musicdh,/img/derivatives/simple/mdh186/thumbnail.jpg,/img/derivatives/simple/mdh186/fullwidth.jpg
mdh187,reference,SongHelix,database,https://www.songhelix.com/,active,TRUE,Seth Keeton,The University of Utah,"There has never been a simple way to search through the vast number of art songs by poet, date of composition, thematic links, keywords, or utility. SongHelix brings this ever-evolving information available into one searchable location. It is an online tool that enables users to search through the vast repertoire of art songs in order to find just the right piece. The website’s immediate purpose is to give singers and teachers the primary online tool for finding related repertoire. A secondary, and broader purpose will be to help to revitalize the form of voice recital by allowing for creative programming through novel associations.",Seth Keeton,,,,186,musicdh_item,musicdh,/img/derivatives/simple/mdh187/thumbnail.jpg,/img/derivatives/simple/mdh187/fullwidth.jpg
mdh188,data,Million Song Dataset,dataset,http://millionsongdataset.com/,active,TRUE,"Thierry Bertin-Mahieux, Daniel P.W. Ellis, Brian Whitman, and Paul Lamere",,"The Million Song Dataset is a freely-available collection of audio features and metadata for a million contemporary popular music tracks.

Its purposes are:
<ul>
<li>To encourage research on algorithms that scale to commercial sizes</li>
<li>To provide a reference dataset for evaluating research</li>
<li>As a shortcut alternative to creating a large dataset with APIs (e.g. The Echo Nest's)</li>
<li>To help new researchers get started in the MIR field</li></ul>
The core of the dataset is the feature analysis and metadata for one million songs, provided by The Echo Nest. The dataset does not include any audio, only the derived features. Note, however, that sample audio can be fetched from services like 7digital, using code we provide.",Francesca Giannetti,@jo_frankie,,https://github.com/tbertinmahieux/MSongsDB,187,musicdh_item,musicdh,/img/derivatives/simple/mdh188/thumbnail.jpg,/img/derivatives/simple/mdh188/fullwidth.jpg
mdh189,collections & exhibits,Songs of the Victorians,archive,http://www.songsofthevictorians.com/,defunct,TRUE,Joanna (Annie) Swafford,,"Songs of the Victorians is an archive of parlor and art song settings of Victorian poems, and also a scholarly tool to facilitate interdisciplinary music and poetry scholarship. It is designed and developed by Joanna Swafford with the generous support of a Scholars' Lab Fellowship from the University of Virginia. It contains four songs: Michael William Balfe's &quot;Come into the Garden, Maud&quot; and Sir Arthur Somervell's &quot;Come into the Garden, Maud&quot; (both based on Alfred Lord Tennyson's monodrama, <i>Maud</i>), Sir Arthur Sullivan's version of Adelaide Procter's &quot;A Lost Chord,&quot; and Caroline Norton's &quot;Juanita.&quot;
<br><br>
Parlor and art song settings of Victorian poems are not mere examples of Victorian kitsch: rather, these settings function as readings of the poems they use as lyrics. Songs of the Victorians includes parlor songs alongside art songs to challenge the conventional musicological assumption that popular, domestic music naïvely misrepresents its poetic source material. Many parlor songs actually perform nuanced understandings of the texts they set and address subjects such as the silencing of women, the difficulty of resolving gender inequalities, religious questionings, and &quot;cross-singing,&quot; or women singing text written for a male character. These socially acceptable, sentimental songs often enabled women to address transgressive topics that otherwise would have been forbidden.",Francesca Giannetti,,Augmented Notes,,188,musicdh_item,musicdh,/img/derivatives/simple/mdh189/thumbnail.jpg,/img/derivatives/simple/mdh189/fullwidth.jpg
mdh190,software,Augmented Notes,tool,http://www.augmentednotes.com/,defunct,TRUE,Joanna (Annie) Swafford,,Augmented Notes integrates scores and audio files to produce interactive multimedia websites in which measures of the score are highlighted in time with music.,Francesca Giannetti,,,,189,musicdh_item,musicdh,/img/derivatives/simple/mdh190/thumbnail.jpg,/img/derivatives/simple/mdh190/fullwidth.jpg
mdh192,collections & exhibits,The VIAMAP Website,website,https://analyses.foredofico.org/,archived,TRUE,Amine Beyhom,CERMAA reseach centre - Lebanon,"In the last few years, the CERMAA (Center for Research on Music from Arabian and Akin countries) has developed a whole new trend in music analyses which were gathered under the VIAMAP, or the Video Animated Music Analysis Project.
<br><br>
Due to the rapid growth of the number of analyses, we decided to create this dedicated website to make it easier for musicologists and other interested people to browse throughout these.
<br><br>
All the VIAMAP analyses initially proposed in our main website at http://foredofico.org/CERMAA/, notably the Analyses page, are available on this site, including additionally the Byzantine chant scales analyses by Amine Beyhom. The site is continuously expanding, and new analyses added in their respective pages.
<br><br>
Video analyses are an alternative to Old Musicology analyses with scores, and allow for direct (graphical and literal) explanations while listening to the analyzed music.",Rosy Beyhom,None but you may email me at rosybeyhom@outlook.com,,https://doi.org/10.5281/zenodo.7902947,190,musicdh_item,musicdh,/img/derivatives/simple/mdh192/thumbnail.jpg,/img/derivatives/simple/mdh192/fullwidth.jpg
mdh193,collections & exhibits,Opera Collection (University of Western Ontario),digital collection,https://archive.org/details/westernopera,active,TRUE,Western Libraries (University of Western Ontario),Western Libraries (University of Western Ontario),"This digital collection reproduces over 600 of the 2,200 physical volumes held at Western Libraries Archives & Special Collections. The items are primarily rare manuscripts and printed first editions of operas and libretti composed between 1597 and 1900. For more information, please visit <a href='https://www.lib.uwo.ca/music/operaspecol.html' target='_blank'>https://www.lib.uwo.ca/music/operaspecol.html</a>.",Brian McMillan,,,,191,musicdh_item,musicdh,/img/derivatives/simple/mdh193/thumbnail.jpg,/img/derivatives/simple/mdh193/fullwidth.jpg
mdh194,collections & exhibits,"American Vernacular Music Manuscripts, ca. 1730-1910: Digital Collections from the American Antiquarian Society and the Center for Popular Music",digital collection,http://popmusic.mtsu.edu/ManuscriptMusic/,active,TRUE,American Antiquarian Society and Center for Popular Music,"Center for Popular Music, Middle Tennessee State University","The period covered by this project found Americans across a wide range of classes, occupations, and regions learning to read and notate music. Ordinary citizens bought copybooks (often pre-ruled with musical staves) or fashioned their own and then inscribed in them the songs, hymns, and tunes that mattered to them, music they had composed, performed, heard, or wanted to learn. Their work has come down to us as prima facie evidence of musical lives desired or lived. &quot;American Vernacular Music Manuscripts, ca. 1730-1910: Digital Collections from the American Antiquarian Society and the Center for Popular Music&quot; has been made possible in part by a major grant from the National Endowment for the Humanities: Exploring the Human Endeavor.",Rachel Morris,@center4popmusic,,,192,musicdh_item,musicdh,/img/derivatives/simple/mdh194/thumbnail.jpg,/img/derivatives/simple/mdh194/fullwidth.jpg
mdh195,collections & exhibits,Printed Sacred Music Database: Printed Sacred Music in Europe 1500-1800,database,http://printed-sacred-music.org/,active,TRUE,"Claudio Bacciagaluppi, David Bryant, Luigi Collarile, Jeffrey Kurtzman, Laurent Pugin, Elena Quaranta, Anne Schnoebelen, Luca Zoppelli",RISM,"Gathering extensive information on prints of sacred music has been a wish of the musicological community for many decades. Such information is of paramount importance for the bibliography of music in general, especially in the seventeenth century, when the printing press produced its greatest output in the sacred domain. The scope of the present database is to cover all sacred music printed in Europe, 1500-1800. It comprises the data collected in the 'Bibliografia della musica sacra pubblicata in Italia fra il 1500 e il 1725 circa' (Venice, Fondazione Cini). The editions now preserved with Catholic music published in Switzerland up to 1800, and the editions with comparable repertoire circulated in the Alpine region, are inserted in the database in the course of a research project started in 2010 by the Institute of Musicology of Fribourg University and the Swiss RISM Office, with the support of the Swiss National Science Foundation.<br>
 
The data is compared to existing bibliographical tools, e.g., RISM A/I and B/I. The database is compliant with the RISM cataloguing scheme based on the MARC21 metadata format. It also contains text incipits and music incipits (in DARMS code) of the printed works. In addition to the bibliographical information, it includes preliminary and concluding textual material of the documents (i.e., title pages, dedications, laudatory poems, advice to users, imprimatur, indices, and colophons). The additional information helps to reveal the network of sponsorships and market strategies that connected dedicatees, printers and booksellers, and to cross-check this data with the circulation of the musical repertoire.",Jeffrey Kurtzman,,,,193,musicdh_item,musicdh,/img/derivatives/simple/mdh195/thumbnail.jpg,/img/derivatives/simple/mdh195/fullwidth.jpg
mdh196,collections & exhibits,Our Subversive Voice: The History and Politics of the English Protest Song,digital collection,https://oursubversivevoice.com/,active,TRUE,"John Street, Oskar Cox Jensen, Alan Finlayson, Angela McShane, Matthew Worley, Helen Stokes",University of East Anglia,"We are investigating the use of song to register protest through the ages, from 1600 to 2020. The core of the website is its database of 750 protest songs from 1600–2020, of which 250 are showcased as the most distinctive and important. These are the ‘curated’ songs you will see by default. We have kept in basic information about the other 500 to allow you to explore further. A number of these are more debatable as ‘English’, ‘protest’ – or even ‘songs’! The 750 were chosen by the project team with help from fifty-five contributing experts.<br><br>We are not simply documenting these songs. We want to show how and why music, in the form of song, has been used as a type of political communication. For us, each protest song need to be understood as part of a specific political and musical moment, mediated by multiple processes and possibilities. This subtler story is essential to understanding why and when musicians have intervened and continue to intervene in politics, and the form taken by these interventions.",Heather Sparling,@CBFraoch,,,194,musicdh_item,musicdh,/img/derivatives/simple/mdh196/thumbnail.jpg,/img/derivatives/simple/mdh196/fullwidth.jpg
mdh197,collections & exhibits,Protest Songs,Digital collection,https://protestsongs.ca/,active,TRUE,Richard MacKinnon,,"On Cape Breton Island, where coal mining and steel making were once an essential part of the region’s culture and economy, protest song and verse are found in abundance. The Protest Song Project is an initiative of The Centre for Cape Breton Studies at Cape Breton University. The program’s goal is to preserve and promote the protest songs and verse that represent the region’s rich industrial heritage. The Centre has been collaborating with local musicians to record many of the songs that were published in the Maritime Labour Herald, a newspaper of the 1920s, that includes both local and international compositions. These songs played an important role in the labour struggles of the 1920s and are an unexplored aspect of Cape Breton’s labour heritage. This is a truly interactive, collaborative and community-minded project. This website is supported by audio tracks that can be purchased by clicking the &quot;Buy&quot; link above.",Heather Sparling,@CBFraoch,WordPress,,195,musicdh_item,musicdh,/img/derivatives/simple/mdh197/thumbnail.jpg,/img/derivatives/simple/mdh197/fullwidth.jpg
mdh198,data,BIPOC Canadian Composers,dataset,https://dataverse.scholarsportal.info/dataset.xhtml?persistentId=doi:10.7939/DVN/OINUZU,active,TRUE,"Carolyn Doi, Janet Hilts",,"This dataset comprises a list of composers who identify as Black, Indigenous, or People of Colour (BIPOC) with a connection to Canada (e.g. are Canadian, working in Canada, or from an Indigenous nation situated in what is now known as Canada).",Heather Sparling,@CBFraoch,,,196,musicdh_item,musicdh,/img/derivatives/simple/mdh198/thumbnail.jpg,/img/derivatives/simple/mdh198/fullwidth.jpg
mdh199,collections & exhibits,The Polyphony Project,digital collection,https://www.polyphonyproject.com/,active,TRUE,Both Miklós et al.,,"The mission of the Polyphony Project is to explore, preserve and present the living musical folklore of Ukrainian villages. In addition to recording the intangible cultural treasures of the Ukrainian peasantry using state-of-the-art technology, our priority is to make this heritage of unparalleled value accessible to contemporary society. Having accumulated over centuries, this legacy is finally available online in an organised form. We hope that our website will attract everyone from music enthusiasts to academic researchers.",Heather Sparling,@CBFraoch,,,197,musicdh_item,musicdh,/img/derivatives/simple/mdh199/thumbnail.jpg,/img/derivatives/simple/mdh199/fullwidth.jpg
mdh200,data,Prices of Music at Breitkopf & Härtel: Publication Lists from the Intelligenz-blatt zur Allgemeine musikalische Zeitung,dataset,https://dstrykowski.shinyapps.io/pricesofmusic/,active,TRUE,Derek R. Strykowski,,"Breitkopf & Härtel founded a weekly newspaper called the <i>Allgemeine musikalische Zeitung</i> in October of 1798. About once per month, for the next forty years, readers also received a supplement called the <i>Intelligenz-blatt zur Allgemeine musikalische Zeitung</i>. A central feature of the <i>Intelligenz-blatt</i>, before its discontinuation in December of 1838, were the publication lists in which Breitkopf & Härtel and other firms would advertise their latest music to potential customers. The 159 publication lists issued by Breitkopf & Härtel itself provide a record of the musical editions (and occasional books and portraits) that the publisher printed during the early nineteenth century. This data set contains 6,405 advertisements for the music of approximately nine hundred composers and arrangers. Details gathered from the publication lists include the issue number, date of advertisement, name of composer or arranger, title of publication (often with key and instrumentation), and price as quoted in Saxon thalers and groschen. Entries are tagged to indicate repeated advertisements. The full name and dates of the credited musician (if known) are also provided.",Derek Strykowski,,,https://github.com/dstrykowski/pricesofmusic/,198,musicdh_item,musicdh,/img/derivatives/simple/mdh200/thumbnail.jpg,/img/derivatives/simple/mdh200/fullwidth.jpg
mdh201,reference,Forbidden Music Regained,"website, database",https://www.forbiddenmusicregained.org,active,TRUE,Carine Alders and Eleonore Pameijer,Leo Smit Stichting,"Since 1996, Leo Smit Stichting has brought music by suppressed composers to life. Sometimes music is heard for the first time, sometimes it resounds after 75 years. We would like to share what we’ve discovered with a wider audience. Every musician can write history with music of unheard-of beauty, awaiting performance. Music that deserves an audience. Every programmer can choose untrodden paths and suprise their audience. Every listener should have access to the most beautiful music, without censoring. Join us in discovering forbidden music. 
<br><br>
Our English language website Forbidden Music Regained offers access to more than 2,000 compositions of suppressed composers. We invite you to browse the database by visiting the works list at the bottom of each composer’s biography. Click a title and discover where you may find the sheetmusic. If we know of a recording, you will find it here. You may even find a direct link to listen online. 
<br><br>However, a more specific search is also possible: for instance by selecting a genre (vocal music, chamber music, orchestral music), selecting specific instrumentations (string quartet, piano solo, choir, flute and piano and much more) or filtering the year in which a work was composed. You may want to filter published works (or works that have never been published) or narrow your search down to composers of your choice. From the results list, it is immediately clear which works can be heard online.
<br><br>
Almost all manuscripts have been scanned, and can be ordered via Donemus webshop.",Carine Alders,@CarineAlders,,,199,musicdh_item,musicdh,/img/derivatives/simple/mdh201/thumbnail.jpg,/img/derivatives/simple/mdh201/fullwidth.jpg
mdh202,collections & exhibits,Coleccionistas de Sonidos. Siglo XIX: El álbum musical de Ana y Cristina Echeverría,digital exhibit,https://en.coleccionistasdesonidos.com/,active,TRUE,"Juana Monsalve, Daniel Castro Pantoja, Juan Fernando Velásquez, Rondy Torres",,"Between 1848 and 1888, several members of the Echeverría family compiled and collected a total of 78 music scores in a binder’s volume. This bound collection of musical scores and other miscellaneous documents belonged to sisters Ana and Cristina Echeverría, who performed the music contained in this binder’s volume at salon gatherings held in Bogotá. Printed and handwritten, the sheet music found in Ana and Cristina Echeverría's binder’s volume feature works by composers such as José María Ponce de León (Bogotá, Colombia), and Jesús María Suárez (Caracas, Venezuela), as well the music of Ana and Cristina's cousin, Rosa Echeverría (Santa Marta, Colombia). This digital exhibition tells the story of this binder’s volume and of its owners. The exhibition also explores the music practices formed around this musical object, the sonic and material flows materialized in the sheet music itself, and everything else that can be told about this particular binder’s volume that accompanied the Echeverria family’s evenings throughout the mid-to-late 19th century.",Eduardo Herrera,,,,200,musicdh_item,musicdh,/img/derivatives/simple/mdh202/thumbnail.jpg,/img/derivatives/simple/mdh202/fullwidth.jpg
mdh203,software,Audiveris,optical music recognition,https://github.com/Audiveris/audiveris,active,TRUE,Hervé Bitteur,,"The goal of an OMR application is to allow the end-user to transcribe a score image into its symbolic counterpart. This opens the door to its further use by many kinds of digital processing such as playback, music edition, searching, republishing, etc.
<br><br>
Audiveris application is built around the tight integration of two main components: an OMR engine and an OMR editor.
<br><br>
<ul><li>The OMR engine combines many techniques, depending on the type of entities to be recognized -- ad-hoc methods for lines, image morphological closing for beams, external OCR for texts, template matching for heads, neural network for all other fixed-size shapes.
Significant progresses have been made, especially regarding poor-quality scores, but experience tells us that 100% recognition ratio is simply out of reach in many cases.</li>
<li>The OMR editor thus comes into play to overcome engine weaknesses in convenient ways. The user can preselect processing switches to adapt the OMR engine before launching transcription of the current score. Then the remaining mistakes can usually be quickly fixed via manual edition of a few music symbols.</li></ul>",Hervé Bitteur,,,,201,musicdh_item,musicdh,/img/derivatives/simple/mdh203/thumbnail.jpg,/img/derivatives/simple/mdh203/fullwidth.jpg
mdh204,collections & exhibits,Virtual Music Heritage,website,https://virtual-music-heritage.fr/,active,TRUE,"Camilla Cavicchi, Philippe Vendrix, Hyacinthe Belliot, Vasco Zara, Alice Nué, David Fiala","Centre d'études supérieures de la Renaissance, Université de Tours","Virtual Music Heritage is a website devoted to music heritage research and interactive installations by Ricercar — the musicology team of the Center for Renaissance Studies (<a href='https://cesr.cnrs.fr/' target='_blank'>CESR</a>) in Tours, France.<br />Since 2010, we have been working on various projects dedicated to raising awareness of our music heritage research in conjunction with private and public museums and cultural institutions.</p><p>We currently have three ongoing programmes:</p><p>1) The <em>Cubiculum musicae</em> — a mobile interactive space equipped with HiFi and HD where visitors can immerse themselves in the sights and sounds of the Renaissance.<br />2) <em>Music in Renaissance Palaces</em> — research-based recreation of the acoustic of spaces designed for playing music, thanks to the collaboration of ensembles specialized in specific Renaissance and Baroque repertoires.<br />3) Interactive 3D reconstructions of lost architectures with sound spatialization.</p>",Camilla Cavicchi,,,,202,musicdh_item,musicdh,/img/derivatives/simple/mdh204/thumbnail.jpg,/img/derivatives/simple/mdh204/fullwidth.jpg
