pid,section,label,claimed_category,link,status,open_access,creators,stewards,blurb,added_by,twitter,tools_used,code_repository,order,layout,collection,thumbnail,full
mdh001,collections & exhibits,Séamus Connolly Collection of Irish Music,"digital collections, network visualization, linked open data, digital curation, music encoding",https://connollymusiccollection.bc.edu/,active,TRUE,"Séamus Connolly, Ben Florin, Anna Kijas, Beth Sweeney, Jack Kearney, Nancy Adams, Chris Houston-Ponchak",Boston College Libraries,"This digital collection features traditional tunes and songs collected by master fiddle player Séamus Connolly, Sullivan Artist in Residence in Irish Music at Boston College (2004 to 2015) and National Heritage Fellow (2013). The collection offers over 330 audio recordings featuring more than 130 musicians, with accompanying stories, transcriptions, and introductory essays. Exploratory work with linked open data and visualizations is also underway.",Anna Kijas,@anna_kijas,"Omeka, Solr, SoundCloud, MusicXML",,000,musicdh_item,musicdh,/img/derivatives/simple/mdh001/thumbnail.jpg,/img/derivatives/simple/mdh001/fullwidth.jpg
mdh002,edition,Burns Antiphoner,"music encoding, digital collections",https://burnsantiphoner.bc.edu/,active,TRUE,"Michael Noone, Graeme Skinner, Anna Kijas, Ben Florin, Juan Carlos Asensio Palacios, Jonathan Mott, Jan Koláček",Boston College Libraries,"The Burns Antiphoner is an interactive resource with a dynamic presentation layer through which content (metadata, music notation, textual incipits) and multimedia based on the encoded inventory and data from a 14th-century Franciscan antiphoner can be queried and viewed. The manuscript has 119 parchment folios with text and notation for antiphons and responsories for the entire annual calendar of saints’ days.",Anna Kijas,@anna_kijas,"Diva.js, Ruby on Rails, Jekyll, Loris, Lunr.js, JSON, MEI",,001,musicdh_item,musicdh,/img/derivatives/simple/mdh002/thumbnail.jpg,/img/derivatives/simple/mdh002/fullwidth.jpg
mdh003,collections & exhibits,Morales Mass Book,"digital publishing, digital collections",https://moralesmassbook.bc.edu/,active,TRUE,"Michael Noone, Graeme Skinner, Ben Florin, Anna Kijas, Sarah DeLorme, Chris Houston-Ponchak",Boston College Libraries,"Morales Mass Book is a companion site to the First Book of Masses by Cristóbal de Morales (ca. 1550-1553), a Spanish composer at the Papal chapel in Rome. Our site explores the Missarum liber primus (Lyon: Moderne, 1546) focusing on the composer, the printer, and the processes that informed the composition of four of Morales’s polyphonic masses. In addition, video and audio recordings invite us into the world of Morales’s superb music. The physical 1546 edition of the Missarum liber primus was acquired by the John J. Burns Library in 2011.",Anna Kijas,@anna_kijas,WordPress,,002,musicdh_item,musicdh,/img/derivatives/simple/mdh003/thumbnail.jpg,/img/derivatives/simple/mdh003/fullwidth.jpg
mdh004,collections & exhibits,Documenting Teresa Carreño,"digital curation, spatial visualization, transcription",https://documentingcarreno.org/,in development,TRUE,Anna E. Kijas,Tufts University,"Documenting Teresa Carreño brings together select primary source materials, such as advertisements, announcements, and reviews from newspapers, with descriptions or annotations in order to document Carreño's career from 1862 - 1917. Access to criticism and reception of her performances, as well as other primary source documents, will be provided in original format when available or through transcription. A selection of Carreño's tours are displayed both geographically on a map and temporally on a timeline, allowing users to explore primary sources or artifacts related to specific events.",,,"Omeka, Carto, Neatline, Scripto",https://github.com/annakijas1/Carreno,003,musicdh_item,musicdh,/img/derivatives/simple/mdh004/thumbnail.jpg,/img/derivatives/simple/mdh004/fullwidth.jpg
mdh005,collections & exhibits,Musical Passage,"digital annotation, transcription, performance",http://www.musicalpassage.org/,active,TRUE,"Laurent Dubois, Mary Caton Lingold, David Garner",Duke University,"Developed by historian Laurent Dubois, PhD candidate in English Mary Caton Lingold, and composer-scholar David Garner, Musical Passage uses a digital format to explore a unique artifact of early African diasporic music. The site is designed around two pages from eighteenth-century British naturalist and collector Hans Sloane’s A Voyage to the Islands (1707), which documents his time in Jamaica in the late 1680s.",Francesca Giannetti,@jo_frankie,"Bootstrap, fullPage.js, jQuery",,004,musicdh_item,musicdh,/img/derivatives/simple/mdh005/thumbnail.jpg,/img/derivatives/simple/mdh005/fullwidth.jpg
mdh006,data,New York Philharmonic Leon Levy Digital Archives,"digital collections, open data",https://archives.nyphil.org/,active,TRUE,Barbara Haws,New York Philharmonic,"The New York Philharmonic played its first concert on December 7, 1842. Since then, it has merged with the New York Symphony, the New/National Symphony, and had a long-running summer season at New York's Lewisohn Stadium. This Performance History database documents all known concerts of all of these organizations, amounting to more than 20,000 performances. The New York Philharmonic Leon Levy Digital Archives provides an additional interface for searching printed programs alongside other digitized items such as marked music scores, marked orchestral parts, business records, and photos.",,,"Hadoop, CodeIgniter, Solr, Abbyy OCR",https://github.com/nyphilarchive/PerformanceHistory/,005,musicdh_item,musicdh,/img/derivatives/simple/mdh006/thumbnail.jpg,/img/derivatives/simple/mdh006/fullwidth.jpg
mdh007,collections & exhibits,Class of 1982 Sequentiary,digitization,https://libraries.mit.edu/music/sequentiary/,active,TRUE,Michael Scott Cuthbert,MIT Libraries,"The Class of 1982 Sequentiary is a book — donated to the MIT Lewis Music Library by the MIT Class of 1982 — from the 15th or early 16th century that contains text and music of a genre of chants called “sequences.” The singing of sequences was largely removed from the Catholic Mass during the reforms of the Counter-Reformation, and thus intact sequentiaries are quite rare. This project was an experiment created to support the Medieval and Renaissance Music (21M.220) class taught by Professor Michael Cuthbert for Spring 2017.",,,"Mirador, IIIF",,006,musicdh_item,musicdh,/img/derivatives/simple/mdh007/thumbnail.jpg,/img/derivatives/simple/mdh007/fullwidth.jpg
mdh008,collections & exhibits,Inventions of Note,digital collections,https://dome.mit.edu/handle/1721.3/188939,active,TRUE,,MIT Libraries,"The Inventions of Note Sheet Music Collection was established in 1997 by the Lewis Music Library at the Massachusetts Institute of Technology. This sheet music collection consists of popular songs and piano compositions that portray technologies (old and new alike) as revealed through song texts and/or cover art. Today we take for granted such inventions as the automobile, airplane, radio, and telephone; they have become part of our daily lives. However, the initial appearance of these and other inventions created a myriad of responses in American society ranging from excitement and delight to anxiety and scorn. This collection reflects those varied reactions through the medium of popular music publications.",,,,,007,musicdh_item,musicdh,/img/derivatives/simple/mdh008/thumbnail.jpg,/img/derivatives/simple/mdh008/fullwidth.jpg
mdh009,software,music21,"computational musicology, software",http://web.mit.edu/music21/,active,TRUE,Michael Scott Cuthbert,Massachusetts Institute of Technology (MIT),"Music21 is a Python-based toolkit for computer-aided musicology. People use music21 to answer questions from musicology using computers, to study large datasets of music, to generate musical examples, to teach fundamentals of music theory, to edit musical notation, study music and the brain, and to compose music (both algorithmically and directly).",,,,https://github.com/cuthbertLab/music21,008,musicdh_item,musicdh,/img/derivatives/simple/mdh009/thumbnail.jpg,/img/derivatives/simple/mdh009/fullwidth.jpg
mdh010,software,music21j,"computational musicology, software, music notation",http://web.mit.edu/music21/music21j/doc/,in development,TRUE,Michael Scott Cuthbert,Massachusetts Institute of Technology (MIT),"Music21j is a Javascript reinterpretation of the Music21 Python package,
a toolkit for computer-aided musicology, now with intuitive HTML/Javascript
interfaces. Some of the things music21j offers are: 
<br><ul>
<li>The ability to visualize and hear changes in Streams quickly (using Vexflow and MIDI.js)</li>
<li>Connections (via Web Midi or JazzSoft plugin) to MIDI devices.</li>
<li>Music theory and analysis modules at the level of music21 ca. 2012</li>
<li>A repository of modules such as metronomes, keyboards, and automatic transcribers.</li></ul>",,,"Javascript, Vexflow",,009,musicdh_item,musicdh,/img/derivatives/simple/mdh010/thumbnail.jpg,/img/derivatives/simple/mdh010/fullwidth.jpg
mdh011,laboratories,Liturgical Cycles,"visualization, software, webpage",https://cuthbertlab.github.io/liturgicalCycles/,active,TRUE,Michael Scott Cuthbert,Massachusetts Institute of Technology (MIT),A visualization of how the liturgical cycles of the year interact. Video with narration by Prof. Elina Hamilton (Boston Conservatory) at <a href='https://www.youtube.com/watch?v=P2VuXO9VKrw' target='_blank'>https://www.youtube.com/watch?v=P2VuXO9VKrw</a>.,,,"Javascript, SVG, Snap.js",https://github.com/cuthbertLab/liturgicalCycles,010,musicdh_item,musicdh,/img/derivatives/simple/mdh011/thumbnail.jpg,/img/derivatives/simple/mdh011/fullwidth.jpg
mdh012,data,Women composers in MusicXML,data,https://github.com/cuthbertLab/womenComposers,in development,TRUE,Michael Scott Cuthbert,Massachusetts Institute of Technology (MIT),MusicXML encoded scores by women composers in the public domain and released for free use.,,,,,011,musicdh_item,musicdh,/img/derivatives/simple/mdh012/thumbnail.jpg,/img/derivatives/simple/mdh012/fullwidth.jpg
mdh013,software,Aruspix,software,http://www.aruspix.net/index.html,active,TRUE,Laurent Pugin,"RISM, Université de Genève, McGill University","Software application for optical recognition, superimposition, and collation of early music prints. Aruspix has been developed with early typographic music prints in mind, meaning mainly those scores printed during the 16th and 17th centuries with movable typefaces. Such scores are often difficult to examine with existing superimposition and optical recognition software, as they present a number of specific layout and format problems and are quite often in a deteriorated state because of their age.",,,OMR,,012,musicdh_item,musicdh,/img/derivatives/simple/mdh013/thumbnail.jpg,/img/derivatives/simple/mdh013/fullwidth.jpg
mdh014,software,Ampact,software,http://ampact.tumblr.com/,active,TRUE,Johanna Devaney,"DDMAL, McGill University",Automated Music Performance Analysis and Comparison Toolkit for MATLAB environment analyzes performance data from recordings when a score is available. Provides estimates of note onsets and offsets for tones with non-percussive onsets that are more robust than blind onset detection algorithms.,,,"MATLAB, Midi",,013,musicdh_item,musicdh,/img/derivatives/simple/mdh014/thumbnail.jpg,/img/derivatives/simple/mdh014/fullwidth.jpg
mdh015,software,Single Interface for Music Score Searching and Analysis (SIMSSA),software,https://simssa.ca/,in development,TRUE,Ichiro Fujinaga,"DDMAL, McGill University","The Single Interface for Music Score Searching and Analysis project (SIMSSA) is teaching computers to recognize the musical symbols in digital images of musical scores, linking materials from the shelves of libraries and museums from around the world in a single digital forum. The SIMSSA project seeks to improve Optical Music Recognition (OMR) technology. Projects include ELVIS, CANTUS, jSymbolic, Liber Usualis, Late Medieval Liturgical Offices (LMLO).",,,,https://github.com/DDMAL,014,musicdh_item,musicdh,/img/derivatives/simple/mdh015/thumbnail.jpg,/img/derivatives/simple/mdh015/fullwidth.jpg
mdh016,reference,Classical Guitar Music in Printed Collections,index,https://guitarmusicincollections.com/,active,TRUE,Ellwood Colahan,University of Denver,"An online, updateable index of collections and anthologies of classical guitar music in printed score. Explanatory article at <a href='https://doi.org/10.1080/10588167.2014.935591' target='_blank'>https://doi.org/10.1080/10588167.2014.935591</a>. Reviewed Fontes 61, No. 3: 303-4.",,,,,015,musicdh_item,musicdh,/img/derivatives/simple/mdh016/thumbnail.jpg,/img/derivatives/simple/mdh016/fullwidth.jpg
mdh017,reference,Handbook for Metastasio Research,website,http://publish.uwo.ca/~metastas/,active,TRUE,"Don Neville, Brian McMillan",University of Western Ontario,"In the process of confronting the enormity of Metastasio research, a considerable amount of disparate information has been drawn together. Yet even as this information serves the Metastasio projects for which it was initially gathered, its frequent usage has suggested that it be made available to the scholarly community at large in as accessible a form as is possible. This decision has lead to the creation of both a Website Handbook for Metastasio Research and a Metastasio Database. More information continues to be gathered and will be added to the appropriate areas in due course. Particularly important for the present, however, is the practical aspect of both the Handbook and the Database. For the information that is already online, Dr. Don Neville, the site director, will be pleased to make additions and deletions or correct any errors that users may be kind enough to bring to his attention.",,,,,016,musicdh_item,musicdh,/img/derivatives/simple/mdh017/thumbnail.jpg,/img/derivatives/simple/mdh017/fullwidth.jpg
mdh018,collections & exhibits,Mayrent Collection of Yiddish Recordings,collection,https://mayrent.wisc.edu/,active,TRUE,"Jeanette Casey (Director, Mills Music Library), Scott A. Carter (Mayrent Institute for Yiddish Culture)","Mills Music Library and the Mayrent Institute for Yiddish Culture, University of Wisconsin-Madison","The Mayrent Collection of Yiddish Recordings features over 6,000 performances of traditional Yiddish music captured on 78rpm discs. As of February 2018, over 2200 recordings are available for free online streaming and are presented with full cataloging and discographic information. A companion website hosted by the Mayrent Institute for Yiddish Culture provides biographies, analytical essays, and histories of Yiddish music in the recording industry. The full digital collection of recordings may be accessed at <a href='https://search.library.wisc.edu/digital/AMayrentRec' target='_blank'>https://search.library.wisc.edu/digital/AMayrentRec</a>.",,,Drupal,,017,musicdh_item,musicdh,/img/derivatives/simple/mdh018/thumbnail.jpg,/img/derivatives/simple/mdh018/fullwidth.jpg
mdh019,reference,Bach digital,digital collections,https://www.bach-digital.net,active,TRUE,Christine Blanken,Bach-Archiv Leipzig,"The Bach digital database portal is designed to provide Bach researchers, professional musicians and amateur music-lovers with solid information on the works of Johann Sebastian Bach and other composers from the Bach family and their whereabouts. Detailed, fully searchable findings from research into Bach are rapidly available via various search forms. Wherever possible, this constantly updated information is accompanied by high-resolution scans of the surviving sources.",,,MyCoRe,https://git.sc.uni-leipzig.de/mycore_applications/music,018,musicdh_item,musicdh,/img/derivatives/simple/mdh019/thumbnail.jpg,/img/derivatives/simple/mdh019/fullwidth.jpg
mdh020,reference,Bonfils-Stanton Post-1945 Women Composers Index,bibliographic and information resources,https://bswci.wordpress.com/,active,TRUE,Sarah Perske and Andrea Copland,Bonfils Stanton Music Library at the University of Denver,"The Bonfils-Stanton Post-1945 Women Composers Index is an open-source searchable index created for the purpose of increasing the visibility, access, and serendipitous discovery of chamber works written after 1945 by women composers. Currently the index includes all post-1945 instrumental chamber works written by women composers housed in the Bonfils-Stanton Music Library. The index is being expanded to include vocal chamber works, and will ultimately be expanded to include works in collections other than the Bonfils-Stanton Music Library.",,,"LibreOffice Base, HTML",,019,musicdh_item,musicdh,/img/derivatives/simple/mdh020/thumbnail.jpg,/img/derivatives/simple/mdh020/fullwidth.jpg
mdh021,edition,Richard Strauss: Works. Critical Edition – Online Platform,edition,http://www.richard-strauss-ausgabe.de/,active,TRUE,"Hartmut Schick (direction), Dominik Leipold (software development)","Bavarian Academy of Sciences and Humanities, Ludwig-Maximilians-Universität München","As an addition to the printed volumes of the edition, the platform features synoptic comparisons of the texts used in the vocal works, document collections for stage and orchestral works and the constituent editorial texts of the printed volumes (subject to a moving wall of 1 year).",,,"eXist-db, Wordpress, oXygen XML Editor",,020,musicdh_item,musicdh,/img/derivatives/simple/mdh021/thumbnail.jpg,/img/derivatives/simple/mdh021/fullwidth.jpg
mdh022,data,Rebalancing the Music Canon,music encoding,https://rebalancing-music-canon.com/,active,TRUE,Anna Kijas,Tufts University,"This music data repository is focused on works by under-represented people and the aim is to decenter the musical canon and make data-driven music scholarship more diverse and inclusive. In particular, this repository will contain a dataset of compositions spanning a large historical period by an under-represented group (primarily women and people of color) that has generally been left out of (big) data driven scholarship work.",,,,https://github.com/annakijas1/rebalancing-music-canon/,021,musicdh_item,musicdh,/img/derivatives/simple/mdh022/thumbnail.jpg,/img/derivatives/simple/mdh022/fullwidth.jpg
mdh023,laboratories,The Natural History of Song,digital collections,http://themusiclab.org/nhs,active,TRUE,Samuel Mehr,Harvard University,"A collection of ethnographic text and audio recordings from all over the world. Used to determine the behavioral, social, acoustical, and musical features that characterize the world's songs. This site provides a public resource to advance the scientific and humanistic study of music.",,,,http://github.com/themusiclab/nhs,022,musicdh_item,musicdh,/img/derivatives/simple/mdh023/thumbnail.jpg,/img/derivatives/simple/mdh023/fullwidth.jpg
mdh024,reference,Open Music Library,reference,https://openmusiclibrary.org,defunct,TRUE,André Avorio,"Alexander Street, a ProQuest company","The Open Music Library is an initiative from Alexander Street to build the world’s largest free index of digital resources for the study of music. Curated by a community of music scholars, students, teachers and librarians, the Open Music Library brings together peer-reviewed journal articles, books and music scores from the world’s digital collections. Leveraging shared ontologies, linked open data and principles of the semantic web, the Open Music Library integrates disparate digital collections and establishes meaningful links between the items they hold.",,,,,023,musicdh_item,musicdh,/img/derivatives/simple/mdh024/thumbnail.jpg,/img/derivatives/simple/mdh024/fullwidth.jpg
mdh025,edition,Beethovens Werkstatt,"music encoding, digital collections, digital editions",http://beethovens-werkstatt.de/,active,TRUE,"Bernhard R. Appel, Joachim Veit","Beethovenhaus, Bonn; Musikwissenschaftliches Seminar, Detmold/Paderborn","The project aims to combine two of the most current research areas in music philology – the exploration of the genesis of musical works incorporated in texts of varying completeness. The projected multi-perspective focus becomes a central musicological research topic for gaining a differentiated picture of the text-in-progress, making it visible and reflecting it critically. Significant insights are anticipated for evaluating the entire compositional history and aesthetics of the 19th and 20th century crucially founded on Beethoven. The project is organized in a set of five modules, each concentrating on different aspects of compositional processes, musical variance, and reorganization of musical material found in Beethoven’s works. Each module builds on its predecessors, with the last showing the full potential of digital editions by combining a traditional edition of the work, a source edition and a genetic edition of the work’s text. These editions will all be prepared and edited using the Edirom tools, whereas on the data layer, everything will be encoded in MEI. The project aims to trace the textual development very closely, so that information beyond the current level of detail provided by MEI is required.",,,,,024,musicdh_item,musicdh,/img/derivatives/simple/mdh025/thumbnail.jpg,/img/derivatives/simple/mdh025/fullwidth.jpg
mdh026,reference,Carl Nielsen's Works: A Catalogue of Carl Nielsen's Works (CNW),"music encoding, metadata, indexing",http://www.kb.dk/dcm/cnw.html,active,TRUE,"Niels Bo Foltmann, Sigfrid Lundberg","Danish Centre for Music Editing, Royal Danish Library","The first ever thematic-bibliographic registration of all Nielsen’s compositions. It is based entirely on the so-called MEI Header (or metadata section) and was edited using the MerMEId tool. It includes all the information usually found in printed thematic catalogues such as instrumentation, date of composition, a short description of each work’s history, a list of movements including incipits, as well as lists of sources, performances, letters, diary entries and other documents.",,,"MEI, MerMEId tool",,025,musicdh_item,musicdh,/img/derivatives/simple/mdh026/thumbnail.jpg,/img/derivatives/simple/mdh026/fullwidth.jpg
mdh027,edition,Corpus Monodicum,"music encoding, digital editions, neume notation",https://corpus-monodicum.de/,active,TRUE,"Andreas Haug, Frank Puppe",Universität Würzburg; Notengrafik Berlin,"A long term edition project of the historically significant, sacred and secular monophonic repertories of the European Middle Ages with Latin texts. It chose MEI for digitizing their transcriptions in the preparation of both its print and digital editions. As standard notation software available on the market is not well suited for capturing transcriptions of neumatic notation, the project teamed up with the music typesetting firm Notengrafik Berlin to develop the specialized browser-based notation editor mono:di that operates directly on MEI data.",,,"MEI, mono:di",,026,musicdh_item,musicdh,/img/derivatives/simple/mdh027/thumbnail.jpg,/img/derivatives/simple/mdh027/fullwidth.jpg
mdh028,reference,Delius Catalogue of Works (DCW),"music encoding, digital editions, metadata, indexing",https://delius.music.ox.ac.uk/catalogue/,active,TRUE,"Joanna Bullivant, Daniel Grimley, David Lewis","University of Oxford, the British Library, and the Royal Library, Denmark","The catalogue was created as part of the wider project Delius, Modernism, and the Sound of Place. This project pursued a new and comprehensive evaluation of Delius, testing the veracity of constructions of the composer as a nationalist and rhapsodic musical portraitist, investigating his compositional methods, and situating him within both different geographical contexts and the complex cultural phenomenon of modernism. Consequently, it was the aim of the catalogue to produce a resource that facilitated this investigation, that provided thorough and up-to-date information on the state of sources for a given work, its process of composition, editing, and revision, its performance history and its relationship to other works.",,,"MEI, MerMEId tool",,027,musicdh_item,musicdh,/img/derivatives/simple/mdh028/thumbnail.jpg,/img/derivatives/simple/mdh028/fullwidth.jpg
mdh029,reference,Detmold Court Theatre,"music encoding, text encoding, metadata, indexing, database",http://www.hoftheater-detmold.de/,active,TRUE,"Irmlind Capelle, Kristina Richts","Musikwissenschaftliches Seminar, Detmold/Paderborn",This project uses MEI for a contextual indexing of sheet music for the first time. It is intended to demonstrate the potential of the standard on the basis of a number of specific examples of varying complexity and to develop a model for indexing other comparable collections.,,,"MEI, TEI, XQuery, JavaScript, XML database",https://github.com/Detmolder-Hoftheater/TheatreTool_1-Dev,028,musicdh_item,musicdh,/img/derivatives/simple/mdh029/thumbnail.jpg,/img/derivatives/simple/mdh029/fullwidth.jpg
mdh030,software,Enhancing Music Notation Addressability,"music encoding, linked data, citation",https://mith.umd.edu/research/enhancing-music-notation-addressability/,active,TRUE,"Raffaele Viglianti, Richard Freedman, Andrew Hankison","University of Maryland, Haverford University, University of Oxford","This project has created the Music Addressability API to provide a web-friendly mechanism for addressing specific portions of music notation on the web, regardless of their format.",,,,https://github.com/music-addressability,029,musicdh_item,musicdh,/img/derivatives/simple/mdh030/thumbnail.jpg,/img/derivatives/simple/mdh030/fullwidth.jpg
