pid,section,label,claimed_category,link,status,open_access,creators,stewards,blurb,added_by,twitter,tools_used,code_repository,order,layout,collection,thumbnail,full
mdh064,software,Telemeta,software,http://telemeta.org/,active,TRUE,"Guillaume Pellerin, Joséphine Simonnot","Parisson, Université Paris 10 Nanterre","Telemeta is a free and open source collaborative multimedia asset management system (MAM) which introduces fast and secure methods to archive, backup, transcode, analyse, annotate and publish any digitalized video or audio file with extensive metadata. It is dedicated to collaborative media archiving projects, research laboratories and digital humanities - especially in ethno-musicological use cases - who need to easily organize and publish documented sound collections of audio files, CDs, digitalized vinyls and magnetic tapes over a strong database, through a smart and secure platform, in accordance with open web standards.",Guillaume Pellerin,,Python,https://github.com/Parisson/Telemeta,063,musicdh_item,musicdh,/img/derivatives/simple/mdh064/thumbnail.jpg,/img/derivatives/simple/mdh064/fullwidth.jpg
mdh065,reference,"Our Culture Resounds, Our Future Reveals: A Legacy of Filipino American Performing Arts in California","Born digital book, interactive pdf",https://californiarevealed.org/islandora/object/cavpp%3A209355,active,TRUE,"Eleanor Lipat-Chesler and Mary Talusan, editors; Maureen Russell, Project Lead Archivist",California Revealed,"A Legacy of Filipino American Performing Arts in California. Created by Ube Arte, a Southern California-based collective of professional musicians, dancers, and academics with a shared mission to advance Philippine cultural research and education among the Pilipinx American community. This project was supported by California Revealed and administered in California by the State Librarian. The program is made possible by funding from the U.S. Institute of Museum and Library Services under the provisions of the Library Services and Technology Act. This project was also funded by the UCLA Department of Ethnomusicology, with additional support provided by the UCLA Ethnomusicology Archive. List of contributors and interviewees (in the order they appear in the book) Dr. Ricardo D. Trimillos; Eleanor Lipat-Chesler; Dr. Mary Talusan; Florante Peter Ibanez; Dr. Neal Matherne; Nico Delmundo; Dr. Bernard Ellorin; Parangal Dance Company; Jonathan Wandag; Dr. Christi-Anne Castro; Marlo Campos; Patrick Tanega; Will Simbol; Darleen Principe; Barbara Ele, Ave Jacinto, Joel Jacinto of Kayamanan Ng Lahi; Peter de Guzman; Michelle Camaya Julian; Guro Alvin Catacutan; Ron and Lydia Querian of House of Gongs; Caroline Cabading; Diane Valencia and Nicanor Evangelista of Ginto Seeds; J.A. Ruanto-Ramirez; Dr. Theodore S. Gonzalves; Giselle Töngi-Walters; Nilo Alcala; Anthony Angelo T. &quot;Gelo&quot; Francisco; Jasmine Orpilla; Dr. Roderick Labrador; Bambu DePistola.",Ube Arte,@ubearte,,,064,musicdh_item,musicdh,/img/derivatives/simple/mdh065/thumbnail.jpg,/img/derivatives/simple/mdh065/fullwidth.jpg
mdh066,collections & exhibits,Berkeley Folk Music Festival,"collection, exhibit",http://bfmf.net/,active,TRUE,Michael J. Kramer,Berkeley Folk Music Project / Northwestern University Libraries,"The Berkeley Folk Music Festival Project is a multimodal investigation of an understudied folk music festival that took place between 1958 and 1970 on the campus of the University of California. The Project includes a fully digitized repository of roughly 33,500 artifacts, an introductory exhibition, and (in development) a series of multimedia essays, an audio podcast series, an oral history repository, lesson plans for teachers, seminars taught by project director and historian Dr. Michael J. Kramer (SUNY Brockport), and an in-person gallery exhibit and book.",Michael J. Kramer,@berkfolkmusfest,"WordPress, custom media repositories at Northwestern University Libraries",,065,musicdh_item,musicdh,/img/derivatives/simple/mdh066/thumbnail.jpg,/img/derivatives/simple/mdh066/fullwidth.jpg
mdh067,software,Serial Analyser,dataset and code,https://github.com/MarkGotham/Serial_Analyser,active,TRUE,Mark Gotham,Mark Gotham,Code for working with 12-tone serial rows and a corpus of examples from the repertoire.,Mark Gotham,@markgothammusic,Python,,066,musicdh_item,musicdh,/img/derivatives/simple/mdh067/thumbnail.jpg,/img/derivatives/simple/mdh067/fullwidth.jpg
mdh068,collections & exhibits,I-Folk,dataset of folk music,http://copoem.usal.es/search,active,TRUE,"María Navarro-Cáceres, Matilde Olarte, Javier Merchán, et al.; Co-Poem","University of Salamanca, University of Padova, University of Coimbra","Corpus of more than 400 songs (and in expansion) of Portuguese, Italian and Spanish folk music. It incorporates a musical analyisis of mode, rhythm and phrases.",María Navarro-Cáceres,@copoemE,,,067,musicdh_item,musicdh,/img/derivatives/simple/mdh068/thumbnail.jpg,/img/derivatives/simple/mdh068/fullwidth.jpg
mdh069,collections & exhibits,Song in the Sumatran Highlands,"Digital ethnography, digital archive",https://songinthesumatranhighlands.com/song-in-the-sumatran-highlands/index,active,TRUE,Jennifer Fraser et al.,Jennifer Fraser,"Song in the Sumatran Highlands is an interactive, interpretative, multimedia digital ethnography and archive that documents and celebrates saluang, a vocal genre from the highlands of West Sumatra, Indonesia.",Jennifer Fraser,@SonginSumatra,"Scalar, TimelineJS, Google Maps, YouTube",,068,musicdh_item,musicdh,/img/derivatives/simple/mdh069/thumbnail.jpg,/img/derivatives/simple/mdh069/fullwidth.jpg
mdh070,collections & exhibits,Decentering the Archive: Visual Fabrications of Sonic Memories,Digital exhibition of research,https://herri.org.za/5/nicola-deane-decentering-archive/,active,TRUE,Nicola Deane,"Africa Open Institute for Music, Research and Innovation","<i>Decentering the Archive: Visual Fabrications of Sonic Momories</i> is a practice-based PhD project that records an artistic engagement with an archive DOMUS (Documentation Centre for Music) within the Music Library of Stellenbosch University. The creative outcomes include short films, sonic poems and sound recordings as well as a body of eggshell fragments recording the text components of the research. I curated these artworks in relation to the written research as a fully integrated dissertation of theory and practice on a digital platform - the online cultural journal project of Africa Open Institute: <a href='http://herri.org.za/' target='_blank'>herri.org.za</a>.",Nicola Deane,,,,069,musicdh_item,musicdh,/img/derivatives/simple/mdh070/thumbnail.jpg,/img/derivatives/simple/mdh070/fullwidth.jpg
mdh071,collections & exhibits,Sounding Spirit Digital Library,digital collections,https://library.soundingspirit.org/,active,TRUE,Jesse P. Karlsberg et al.,"Emory Center for Digital Scholarship, Emory University","The Sounding Spirit digital library features songbooks and hymnals published across the southern United States from 1850 to 1925. Spanning holdings from four partner archives, the digital library includes words-only hymnals, gospel songbooks, spiritual collections, and shape-note tunebooks, demonstrating the wide variety of form, content, and presentation in southern vernacular sacred songbooks. Organized into collections that highlight texts’ associated places, populations, genres, and denominational affiliations, the digital library allows for rich engagement with songbooks and hymnals seminal in their respective eras, but historically underrepresented in both archival holdings and scholarship.",Sara Palmer and Jesse P. Karlsberg,@SoundingSpirit,"Readux, OCR, OMR",,070,musicdh_item,musicdh,/img/derivatives/simple/mdh071/thumbnail.jpg,/img/derivatives/simple/mdh071/fullwidth.jpg
mdh072,reference,Nigerian Christian Songbook: a digital interactive songbook,songbook,https://sites.baylor.edu/nigerianchristiansongs/,active,TRUE,Dr. Monique M. Ingalls,Nigerian Baptist Theological Seminary and Baylor University Center for Christian Music Studies,This songbook was compiled by students at the Nigerian Baptist Theological Seminary. The songs on this site are organized into categories using the Titon Music Culture Model. We encourage you to explore and utilize this resource within your congregation or university classroom.,Beth Farwell,,WordPress,,071,musicdh_item,musicdh,/img/derivatives/simple/mdh072/thumbnail.jpg,/img/derivatives/simple/mdh072/fullwidth.jpg
mdh073,edition,Anton Webern Gesamtausgabe,digital edition,https://edition.anton-webern.ch,active,TRUE,"Matthias Schmidt (Project manager), Simon Obert, Thomas Ahrend, Julia Bungardt, Michael Matter, Barbara Schingnitz, Stefan Münnich",University of Basel,"The Anton Webern Gesamtausgabe (AWG) is a critical-historical edition which aims to make Webern’s entire oeuvre accessible to musical scholarship and practice in a scholarly form. The edition includes not only all the works Webern himself had forwarded to be printed but also their unpublished variants. It also includes compositions that were never made public in his lifetime, works from his youth and student years, as well as fragments, sketches, arrangements and revisions of his and other scores.",Stefan Münnich,@music_enfanthen,"Angular, SVG, RDF",https://github.com/webern-unibas-ch/awg-app,072,musicdh_item,musicdh,/img/derivatives/simple/mdh073/thumbnail.jpg,/img/derivatives/simple/mdh073/fullwidth.jpg
mdh074,laboratories,Dig That Lick: Analysing Large-Scale Data for Melodic Patterns in Jazz Performance,"database, similarity search, pattern search, visualization",http://dig-that-lick.eecs.qmul.ac.uk/,active,TRUE,"Simon Dixon (PI), Krin Gabbard, Hélène-Camille Crayencour, Geoffroy Peeters, Martin Pfleiderer, Gabriel Solis, Tillman Weyde","Queen Mary University of London, Columbia University, National Center for Scientific Research (CNRS), Institute for Research and Coordination in Acoustics/Music (IRCAM), University of Music Franz Liszt, University of Illinois Champaign Urbana, City University of London","The recorded legacy of jazz spans a century and provides a vast corpus of data documenting its development. Recent advances in digital signal processing and data analysis technologies enable automatic recognition of musical structures and their linkage through metadata to historical and social context. Automatic metadata extraction and aggregation give unprecedented access to large collections, fostering new interdisciplinary research opportunities. This project aims to develop innovative technological and music-analytical methods to gain fresh insight into jazz history by bringing together renowned scholars and results from several high-profile projects. Musicologists and computer scientists will together create a deeper and more comprehensive understanding of jazz in its social and cultural context. We exemplify our methods via a full cycle of analysis of melodic patterns, or <i>licks</i>, from audio recordings to an aesthetically contextualised and historically situated understanding.",Francesca Giannetti,@jo_frankie,"SQLITE3, PostgreSQL, D3.js, MeloSpySuite, melconv, melfeature, melpat",,073,musicdh_item,musicdh,/img/derivatives/simple/mdh074/thumbnail.jpg,/img/derivatives/simple/mdh074/fullwidth.jpg
mdh075,laboratories,Phantom Islands,sonic atlas,http://andrewpekler.com/phantom-islands/,active,TRUE,"Andrew Pekler, Flavio Gortana,  Kiwi Menrath","Jeu de Paume and DICRéAM (dispositif d’aide pour la création artistique multimédia et numérique), CNC (Centre National du Cinéma et de l'Image Animée)","Phantom Islands are artifacts of the age of maritime discovery and colonial expansion. During centuries of ocean exploration these islands were sighted, charted, described and even explored – but their existence has never been ultimately verified. Poised somewhere between cartographical fact and maritime fiction, they haunted seafarers’ maps for hundreds of years, inspiring legends, fantasies, and counterfactual histories. Phantom Islands – A Sonic Atlas interprets and presents these imaginations in the form of an interactive map which charts the sounds of a number of historical phantom islands.",Francesca Giannetti,@jo_frankie,"Mapbox, Tone.js",,074,musicdh_item,musicdh,/img/derivatives/simple/mdh075/thumbnail.jpg,/img/derivatives/simple/mdh075/fullwidth.jpg
mdh076,reference,plainsightSOUND,"reference, digital exhibition",https://www.plainsightsound.com/,active,TRUE,Uchenna Ngwe,Uchenna Ngwe,"plainsightSOUND is a music research project, aimed at rediscovering colonial and postcolonial voices in British classical music.
<br> Focusing on the stories of classical musicians in Britain of African and Caribbean descent, including those from former British colonies, the project will explore their lives as well as their musical activity in Britain before 1970.",Uchenna Ngwe,@plainsightsound,"WordPress, Google Sheets, HP5",,075,musicdh_item,musicdh,/img/derivatives/simple/mdh076/thumbnail.jpg,/img/derivatives/simple/mdh076/fullwidth.jpg
mdh077,laboratories,CRIM (Citations: The Renaissance Imitation Mass),"reference, data, laboratories",https://crimproject.org/,active,TRUE,"Richard Freedman, David Fiala","Haverford College; Centre d’Études Supérieures de la Renaissance, Tours","CRIM is a collaborative project about similarity in music, with human annotated scores, databases of related pieces, and (soon in public) an entire suite of Python/Pandas analytic tools that find melodic/rhythmic/contrapuntal patterns in just about any encoded symbolic music score. These tools will be incorporated into CRIM.",,,"Django, Solr, JSON",,076,musicdh_item,musicdh,/img/derivatives/simple/mdh077/thumbnail.jpg,/img/derivatives/simple/mdh077/fullwidth.jpg
mdh078,reference,Jewish Music Research Centre at the Hebrew University of Jerusalem,reference,https://jewish-music.huji.ac.il/,active,TRUE,Joseph Sprinzak,Jewish Music Research Centre,"Full access to documentary ethnographic recordings, edited publications and database on Jewish music.",Edwin Seroussi,,Drupal,,077,musicdh_item,musicdh,/img/derivatives/simple/mdh078/thumbnail.jpg,/img/derivatives/simple/mdh078/fullwidth.jpg
mdh079,collections & exhibits,Bronx Tunes - Irish Musicians in The Bronx,Digital Ethnography,https://bronxtunes.wordpress.com,active,TRUE,Scott Spencer,,"This project was instituted to document a slice of Irish musical life in The Bronx, New York through a series of interviews with influential local musicians – detailing their personal and family involvement with music in their own words and on their own instruments.",Scott Spencer,,,https://github.com/CRIM-Project/CRIM-online,078,musicdh_item,musicdh,/img/derivatives/simple/mdh079/thumbnail.jpg,/img/derivatives/simple/mdh079/fullwidth.jpg
mdh080,collections & exhibits,Capturing O'Neill,digital collection,https://scottbspencer.com/oneill/,in development,TRUE,"Scott Spencer, Aileen Dillane, Daniel Neely, Mike O'Malley",,"With the Irish Traditional Music Archive in Dublin and the <a href='https://wardirishmusicarchives.com/Ward-Music-Archives/ONeill-Dedication-Pages.htm' target='_blank'>Ward Irish Music Archives</a> in Milwaukee, this initiative will build an online display of signed dedication pages of books by Capt. Francis O'Neill, gifted to others by the author. Each entry will have a biography of the recipient, and (if possible) a story of provenance for each book.",Scott Spencer,,,,079,musicdh_item,musicdh,/img/derivatives/simple/mdh080/thumbnail.jpg,/img/derivatives/simple/mdh080/fullwidth.jpg
mdh081,software,metaScore,open educational resource,https://metascore.philharmoniedeparis.fr/,active,TRUE,Marie-Hélène Serra et al.,"Département Éducation et Ressources, Cité de la musique - Philharmonie de Paris","Designed for teachers and professionals in the arts and culture sector, metaScore is a complete online authoring tool that specializes in handling music for educational uses. It makes available a shared library of graphic elements that may be used in your musical applications and listening guides.",Kimmy Szeto,@Kimmy_Szeto,,,080,musicdh_item,musicdh,/img/derivatives/simple/mdh081/thumbnail.jpg,/img/derivatives/simple/mdh081/fullwidth.jpg
mdh082,software,SPEAR (Sinusoidal Partial Editing Analysis and Resynthesis),software,https://www.klingbeil.com/spear/,active,TRUE,Michael Klingbeil,"Computer Music Center, Columbia University","SPEAR is an application for audio analysis, editing and synthesis. The analysis procedure (which is based on the traditional McAulay-Quatieri technique) attempts to represent a sound with many individual sinusoidal tracks (partials), each corresponding to a single sinusoidal wave with time varying frequency and amplitude.
<br>
Something which closely resembles the original input sound (a resynthesis) can be generated by computing and adding all of the individual time varying sinusoidal waves together. In almost all cases the resynthesis will not be exactly identical to the original sound (although it is possible to get very close).
<br>
Aside from offering a very detailed analysis of the time varying frequency content of a sound, a sinusoidal model offers a great deal of flexibility for editing and manipulation. SPEAR supports flexible selection and immediate manipulation of analysis data, cut and paste, and unlimited undo/redo. Hundreds of simultaneous partials can be synthesized in real-time and documents may contain thousands of individual partials dispersed in time. SPEAR also supports a variety of standard file formats for the import and export of analysis data.",Kimmy Szeto,@Kimmy_Szeto,,,081,musicdh_item,musicdh,/img/derivatives/simple/mdh082/thumbnail.jpg,/img/derivatives/simple/mdh082/fullwidth.jpg
mdh083,reference,Sonic Glossary,Open educational resource,https://cmc.music.columbia.edu/projects/sonic-glossary,archived,FALSE,Ian Bent,"Computer Music Center, Columbia University","The Sonic Glossary is an innovative teaching tool for music appreciation. It assumes no musical training on the part of the user. It defines musical terms by combining visual text, spoken voice, pictures, graphic images, and musical sound in creative ways, delivering them in high-quality audio for private study. The Sonic Glossary does not replace classroom teaching: at Columbia University Music Humanities is taught by small-group discussion, which the Sonic Glossary reinforces and amplifies. Definitions are written by the teaching staff of Music Humanities, sound is recorded and mixed by the Computer Music Center, and the illustrations and animations are generated at CCNMTL. The finished components are then compiled and released on the Web. The Sonic Glossary contains over 75 entries.",Kimmy Szeto,@Kimmy_Szeto,,,082,musicdh_item,musicdh,/img/derivatives/simple/mdh083/thumbnail.jpg,/img/derivatives/simple/mdh083/fullwidth.jpg
mdh084,software,J.P. Morgan Kids Digital Dance and Sound Project,Open educational resource,http://sites.music.columbia.edu/kids/cdrom/JPMCkids/base/docs/CDROM/CDROMindex.html,archived,TRUE,David Birchfield et al.,"Computer Music Center, Columbia University","The CMC brings music technology to children and their teachers. A collaborative project of Ballet Frankfurt, Lego, mak.frankfurt, Paul Kaiser, and the CMC. Sponsored by J.P. Morgan. Participation of local school children organized with the collaboration of the Creative Arts Laboratory of Columbia University’s Teachers College and its city wide artists-in-residence program for schools.",Kimmy Szeto,@Kimmy_Szeto,,,083,musicdh_item,musicdh,/img/derivatives/simple/mdh084/thumbnail.jpg,/img/derivatives/simple/mdh084/fullwidth.jpg
mdh085,software,MEAPsoft,software,https://www.meapsoft.org/,archived,TRUE,Douglas Repetto,"Computer Music Center, Columbia University",MEAPsoft is a program for automatically segmenting and rearranging music audio recordings. It is aimed at musicians and experimenters who want to play with new ways to put audio fragments together using state of the art machine listening and analysis techniques.,Kimmy Szeto,@Kimmy_Szeto,,,084,musicdh_item,musicdh,/img/derivatives/simple/mdh085/thumbnail.jpg,/img/derivatives/simple/mdh085/fullwidth.jpg
mdh086,software,PeRColate,code,https://github.com/Cycling74/percolate,active,TRUE,"Dan Trueman, Luke Dubois","Computer Music Center, Columbia University","PeRColate is a collection of synthesis, signal processing, and image processing objects (with source-code toolkit) for Max/MSP.",Kimmy Szeto,@Kimmy_Szeto,MAX/MSP,,085,musicdh_item,musicdh,/img/derivatives/simple/mdh086/thumbnail.jpg,/img/derivatives/simple/mdh086/fullwidth.jpg
mdh087,software,RTcmix,"code, software",http://rtcmix.org/,active,TRUE,"Brad Garton, David Topper","Computer Music Center, Columbia University","RTcmix is a real-time software &quot;language&quot; for doing digital sound synthesis and signal-processing. It is written in C/C++, and is distributed open-source, free of charge. In certain respects, it is similar in function to other extant unit-generator-based software languages such as CSOUND, SuperCollider and (to a lesser extent) JSyn and Max/MSP -- they do share a common heritage, after all. There are some differences, however, between all these languages... and variety is of course the spice of life! <br>
So if you've been searching the web high and low for just the right library of DSP functions to include in your latest &amp; greatest &quot;killer&quot; (or maybe &quot;peacefully coexisting&quot;?) app, then RTcmix may just be the Right Package for You.",Kimmy Szeto,@Kimmy_Szeto,"C/C++ ; perl, Python ; ports to Linux, MacOS and Windows",,086,musicdh_item,musicdh,/img/derivatives/simple/mdh087/thumbnail.jpg,/img/derivatives/simple/mdh087/fullwidth.jpg
mdh088,collections & exhibits,Disaster Songs of Atlantic Canada,digital collection; exhibit; website,http://disastersongs.ca/,active,TRUE,Heather Sparling,,A collection of hundreds of songs about disasters in Atlantic Canada. Includes descriptions of disastrous events and provides lyrics for many songs. Links to audio recordings are provided when available. Includes pedagogical materials for teachers as well as a blog.,Heather Sparling,@CBFraoch,,,087,musicdh_item,musicdh,/img/derivatives/simple/mdh088/thumbnail.jpg,/img/derivatives/simple/mdh088/fullwidth.jpg
mdh089,collections & exhibits,Cluas ri Claisneachd,digital collection; archive; searchable database,https://dasg.ac.uk/audio/about/crc/en,active,TRUE,,Digital Archive of Scottish Gaelic,Digitized recordings of 140 hours' worth of audio recordings made in Scotland and Canada and held by the Celtic and Gaelic Department at the University of Glasgow. Includes a number of songs.,Heather Sparling,@CBFraoch,,,088,musicdh_item,musicdh,/img/derivatives/simple/mdh089/thumbnail.jpg,/img/derivatives/simple/mdh089/fullwidth.jpg
mdh090,reference,Language in Lyrics,index,https://languageinlyrics.com/song-database/,active,TRUE,Heather Sparling,,"Language in Lyrics seeks to index as many Gaelic songs known in Nova Scotia (Canada) as possible. About 6,000 songs have been indexed, including a rich set of metadata. Currently, the index exists as spreadsheets available online. However, this will move to a fully searchable database managed by the Digital Archive of Scottish Gaelic by April 2022.",Heather Sparling,@CBFraoch,,,089,musicdh_item,musicdh,/img/derivatives/simple/mdh090/thumbnail.jpg,/img/derivatives/simple/mdh090/fullwidth.jpg
mdh091,collections & exhibits,The Library of Historical Audio Recordings at i78s,"digital collection, exhibit, archive, searchable database",https://i78s.org/,active,TRUE,David Giovannoni,,"This collection holds 40,000 digitized 78 rpm sound recordings. Requires free log-in to listen.",Bonnie Finn,,,,090,musicdh_item,musicdh,/img/derivatives/simple/mdh091/thumbnail.jpg,/img/derivatives/simple/mdh091/fullwidth.jpg
mdh092,collections & exhibits,Klezmer Archive Project,"digital collection, archive tool, searchable data",https://klezmerinstitute.org/klezmerarchive/,in development,TRUE,"Christina Crowder, Clara Byom",Klezmer Institute,"The Klezmer Archive project aims to create a universally accessible, useful resource for interaction, discovery, and research on all available information about klezmer music.",Christina Crowder,,,,091,musicdh_item,musicdh,/img/derivatives/simple/mdh092/thumbnail.jpg,/img/derivatives/simple/mdh092/fullwidth.jpg
mdh093,collections & exhibits,Westminster Choir College Archival Audio Collection,digital collection,https://cdm15457.contentdm.oclc.org/digital/collection/p16471coll5/search,active,TRUE,,"Talbott Music Library, Westminster Choir College of Rider University","The Westminster Choir College Archival Audio Collection includes commercial and locally-produced recordings spanning from approximately 1926 to the early 1980s. The collection includes many rare or unique recordings of a vast range of choral performances, rehearsals with renowned orchestras and conductors, faculty and student recitals, festivals, guest performers, lectures, convocations and commencements, and interviews with prominent figures in choral and church music. The collection will grow in scope as more recordings are digitized.",Stephanie Sussmeier,@StephanieSussme,CONTENTdm,,092,musicdh_item,musicdh,/img/derivatives/simple/mdh093/thumbnail.jpg,/img/derivatives/simple/mdh093/fullwidth.jpg
